{
  "id": "M0-engineering-constitution",
  "goal": "Install the deterministic engineering constitution and certification kernel without changing product behavior.",
  "requirementIds": [
    "ARCH-001",
    "TEL-001",
    "MAIL-001",
    "DB-001",
    "SCOPE-001",
    "CERT-001",
    "REL-001"
  ],
  "allowedPaths": [
    "zeroai.constitution.yaml",
    "architecture.registry.json",
    "requirements/**",
    "decisions/**",
    "contracts/**",
    "policies/**",
    "certification/**",
    "agent-registry/**",
    "scripts/zeroai-certify.mjs",
    "package.json",
    ".github/workflows/ci.yml",
    "README.md"
  ],
  "protectedPaths": [
    "src/**",
    "db/**",
    ".env.example",
    "docs/NEON_PRODUCTION.md",
    "docs/SERVICE_AUTH.md"
  ],
  "invariants": [
    "No runtime feature behavior changes.",
    "Existing Neon Data API persistence remains intact.",
    "Existing auth and tenant authority boundaries remain intact."
  ],
  "acceptanceCriteria": [
    {
      "id": "M0-AC-001",
      "description": "Required governance artifacts exist and parse.",
      "evidence": [
        "certification script exit 0"
      ]
    },
    {
      "id": "M0-AC-002",
      "description": "Forbidden runtime providers and database drivers are absent.",
      "evidence": [
        "negative architecture scan exit 0"
      ]
    },
    {
      "id": "M0-AC-003",
      "description": "Existing typecheck, tests and production build still pass.",
      "evidence": [
        "GitHub Actions zeroai-certification"
      ]
    }
  ],
  "prohibitedChanges": [
    "No src/** changes.",
    "No db/** changes.",
    "No direct deployment.",
    "No provider substitution."
  ]
}
